{
  "schema_version": "1.0",
  "status": "progressing",
  "current_action": "Refactoring the parser module to support incremental reads.",
  "goal_alignment": "aligned",
  "evidence": [
    {
      "ref_type": "event",
      "ref_id": "evt:1",
      "claim": "Agent modified parser.py to add incremental read support."
    }
  ],
  "basis_ids": ["evt:1"],
  "concerns": [],
  "needs_attention": false,
  "recommended_human_action": null,
  "confidence_percent": 82,
  "assessed_by": "luna",
  "escalation_reason": null,
  "event_cursor": 42,
  "assessed_at": "2026-08-13T10:02:00Z"
}
